{
  "schema_version": "deadair.report.v1",
  "generated_at": "2026-07-05T15:45:49.978508Z",
  "producer": {"name":"deadair","version":"0.3.4"},
  "backend": "elastic",
  "backend_metadata": {
    "name": "elastic",
    "product": "Elastic Security",
    "observed_version": "8.17.4",
    "supported_version_lines": ["8.x"],
    "capabilities": [
      {"name":"rule_inventory","status":"supported"},
      {"name":"source_resolution","status":"partial","detail":"legacy sample captured before backend-native resolution evidence"},
      {"name":"freshness","status":"supported"},
      {"name":"docs_storage","status":"supported"},
      {"name":"schema","status":"supported"},
      {"name":"required_fields","status":"supported"},
      {"name":"ingest_lag","status":"supported"},
      {"name":"candidate_parsing","status":"supported"},
      {"name":"remote","status":"listed-only"}
    ]
  },
  "instance": "elastic",
  "summary": {
    "rules": 1276,
    "enabled_rules": 500,
    "sources": 10,
    "healthy_sources": 9,
    "degraded_sources": 1,
    "dead_detections": 45,
    "impaired_detections": 1,
    "unmapped_rules": 0,
    "unused_sources": 1,
    "unused_bytes": 7143,
    "unused_telemetry_assessment": "legacy",
    "input_resolution": {
      "resolved": 0,
      "empty": 0,
      "unsupported": 0,
      "unavailable": 0,
      "remote": 0,
      "ambiguous": 0
    }
  },
  "sources": [
    {
      "name": "batchy-events",
      "status": "ok",
      "age_seconds": 76.978531,
      "docs": 30,
      "size_bytes": 6792,
      "volume": {
        "status": "warming",
        "warmup": true
      },
      "consumers": 1
    },
    {
      "name": "logs-endpoint.events.network-default",
      "status": "ok",
      "age_seconds": 76.978532,
      "docs": 25,
      "size_bytes": 5160,
      "volume": {
        "status": "warming",
        "warmup": true
      },
      "consumers": 60
    },
    {
      "name": "logs-endpoint.events.process-default",
      "status": "ok",
      "age_seconds": 76.978536,
      "docs": 25,
      "size_bytes": 5144,
      "volume": {
        "status": "warming",
        "warmup": true
      },
      "consumers": 249
    },
    {
      "name": "logs-myapp.custom-default",
      "status": "ok",
      "age_seconds": 76.97854,
      "docs": 200,
      "size_bytes": 10455,
      "volume": {
        "status": "warming",
        "warmup": true
      },
      "consumers": 6
    },
    {
      "name": "logs-system.auth-default",
      "status": "stale",
      "age_seconds": 259276.978541,
      "docs": 25,
      "size_bytes": 5144,
      "volume": {
        "status": "warming",
        "warmup": true
      },
      "consumers": 6
    },
    {
      "name": "logs-system.security-default",
      "status": "ok",
      "age_seconds": 76.978534,
      "docs": 25,
      "size_bytes": 5144,
      "volume": {
        "status": "warming",
        "warmup": true
      },
      "consumers": 193
    },
    {
      "name": "logs-windows.powershell-default",
      "status": "ok",
      "age_seconds": 76.978544,
      "docs": 25,
      "size_bytes": 5144,
      "volume": {
        "status": "warming",
        "warmup": true
      },
      "consumers": 59
    },
    {
      "name": "logs-windows.sysmon_operational-default",
      "status": "ok",
      "age_seconds": 76.978541,
      "docs": 25,
      "size_bytes": 5144,
      "volume": {
        "status": "warming",
        "warmup": true
      },
      "consumers": 307
    },
    {
      "name": "metrics-myapp.usage-default",
      "status": "ok",
      "age_seconds": 76.978532,
      "docs": 100,
      "size_bytes": 7143,
      "volume": {
        "status": "warming",
        "warmup": true
      },
      "consumers": 0
    },
    {
      "name": "winlogbeat-2026.07.04",
      "status": "ok",
      "age_seconds": 76.978526,
      "docs": 25,
      "size_bytes": 7020,
      "volume": {
        "status": "warming",
        "warmup": true
      },
      "consumers": 390
    }
  ],
  "dead_detections": [
    {
      "id": "b01b03db-3411-4773-8064-b4f774c9755f",
      "name": "Persistence via WMI Standard Registry Provider",
      "severity": "high",
      "reason": "disconnected",
      "patterns": [
        "logs-endpoint.events.registry-*",
        "endgame-*"
      ]
    },
    {
      "id": "1e9e729e-9bcf-4076-af98-ce926ba5f0ca",
      "name": "Potential Remote Credential Access via Registry",
      "severity": "high",
      "reason": "disconnected",
      "patterns": [
        "logs-endpoint.events.file-*"
      ]
    },
    {
      "id": "5711e016-2246-42e4-8af7-40a3d5b04591",
      "name": "Sensitive Registry Hive Access via RegBack",
      "severity": "high",
      "reason": "disconnected",
      "patterns": [
        "logs-endpoint.events.file-*"
      ]
    },
    {
      "id": "4f3a922b-2472-4316-82d4-2464e03cf859",
      "name": "Untrusted Driver Loaded",
      "severity": "high",
      "reason": "disconnected",
      "patterns": [
        "logs-endpoint.events.library-*"
      ]
    },
    {
      "id": "7e36a6a5-fb19-43a9-b856-bdc2788a0cd1",
      "name": "Component Object Model Hijacking",
      "severity": "medium",
      "reason": "disconnected",
      "patterns": [
        "logs-endpoint.events.registry-*"
      ]
    },
    {
      "id": "ffd1d58b-2753-46be-b4d2-f65ee4685279",
      "name": "Deprecated - Container Workload Protection",
      "severity": "medium",
      "reason": "disconnected",
      "patterns": [
        "logs-cloud_defend.alerts-*"
      ]
    },
    {
      "id": "4d124476-70c7-468f-876b-fdf88fc6bd82",
      "name": "Downloaded Shortcut Files",
      "severity": "medium",
      "reason": "disconnected",
      "patterns": [
        "logs-endpoint.events.file-*"
      ]
    },
    {
      "id": "f113f488-54ae-4dfe-b25e-a33359c706ca",
      "name": "Downloaded URL Files",
      "severity": "medium",
      "reason": "disconnected",
      "patterns": [
        "logs-endpoint.events.file-*"
      ]
    },
    {
      "id": "bd77c2e9-0aac-4a06-910d-7025560f65f8",
      "name": "Endpoint Security (Elastic Defend)",
      "severity": "medium",
      "reason": "disconnected",
      "patterns": [
        "logs-endpoint.alerts-*"
      ]
    },
    {
      "id": "e3417a55-62f7-4b9b-af28-183acb878db5",
      "name": "Expired or Revoked Driver Loaded",
      "severity": "medium",
      "reason": "disconnected",
      "patterns": [
        "logs-endpoint.events.library-*"
      ]
    },
    {
      "id": "aafb9e62-c11d-4a32-ae79-abeba5f1a197",
      "name": "First Time Seen Driver Loaded",
      "severity": "medium",
      "reason": "disconnected",
      "patterns": [
        "logs-endpoint.events.library-*"
      ]
    },
    {
      "id": "84a0cbb0-5e69-40a1-abd5-06ded1df454b",
      "name": "LSASS Process Access via Windows API",
      "severity": "medium",
      "reason": "disconnected",
      "patterns": [
        "logs-endpoint.events.api-*",
        "logs-m365_defender.event-*"
      ]
    },
    {
      "id": "9092a5c4-e625-4e8e-a2ba-a58bc4912e05",
      "name": "Persistence via a Windows Installer",
      "severity": "medium",
      "reason": "disconnected",
      "patterns": [
        "logs-endpoint.events.registry-*",
        "logs-endpoint.events.file-*"
      ]
    },
    {
      "id": "e47c605b-50b3-4219-b632-4dbe4df3bd33",
      "name": "Potential LSA Authentication Package Abuse",
      "severity": "medium",
      "reason": "disconnected",
      "patterns": [
        "logs-endpoint.events.registry-*",
        "endgame-*",
        "logs-m365_defender.event-*"
      ]
    },
    {
      "id": "44801442-40e9-4c92-86ba-ab658a6136ea",
      "name": "Potential Port Monitor or Print Processor Registration Abuse",
      "severity": "medium",
      "reason": "disconnected",
      "patterns": [
        "logs-endpoint.events.registry-*",
        "endgame-*",
        "logs-m365_defender.event-*"
      ]
    },
    {
      "id": "fc418a24-4532-4831-95e7-999672d5ddd3",
      "name": "Potential Windows Session Hijacking via CcmExec",
      "severity": "medium",
      "reason": "disconnected",
      "patterns": [
        "logs-endpoint.events.library-*"
      ]
    },
    {
      "id": "31087af7-be0c-456c-be95-883db1199fa3",
      "name": "Remote File Copy via TeamViewer",
      "severity": "medium",
      "reason": "disconnected",
      "patterns": [
        "logs-endpoint.events.file-*",
        "logs-sentinel_one_cloud_funnel.*"
      ]
    },
    {
      "id": "e365c188-2ee2-4e9d-9e0c-51b37714d99d",
      "name": "Suspicious Module Loaded by LSASS",
      "severity": "medium",
      "reason": "disconnected",
      "patterns": [
        "logs-endpoint.events.library-*",
        "endgame-*"
      ]
    },
    {
      "id": "5aeac68f-d2fd-4e40-9adc-1a87e8c6fadd",
      "name": "Suspicious PowerShell Engine ImageLoad",
      "severity": "medium",
      "reason": "disconnected",
      "patterns": [
        "logs-endpoint.events.library-*"
      ]
    },
    {
      "id": "7c99aa6a-6d8d-4878-a050-bdecb6dc7898",
      "name": "Third-party Backup Files Deleted via Unexpected Process",
      "severity": "medium",
      "reason": "disconnected",
      "patterns": [
        "logs-endpoint.events.file-*",
        "endgame-*",
        "logs-sentinel_one_cloud_funnel.*"
      ]
    },
    {
      "id": "36887d23-754b-403a-ae57-93cba1848847",
      "name": "Unsigned DLL Loaded by Svchost",
      "severity": "medium",
      "reason": "disconnected",
      "patterns": [
        "logs-endpoint.events.library-*"
      ]
    },
    {
      "id": "3e5307bc-f3d9-4871-a4fd-5162ea743fcf",
      "name": "Unsigned DLL Side-Loading from a Suspicious Folder",
      "severity": "medium",
      "reason": "disconnected",
      "patterns": [
        "logs-endpoint.events.library-*"
      ]
    },
    {
      "id": "f66b0eca-dd87-420d-9f09-633ec4e81baa",
      "name": "Veeam Backup Library Loaded by Unusual Process",
      "severity": "medium",